{"beats":[{"id":"S1","purpose":"Establish the anomalous discovery and place Mara between practical duty and unresolved anger toward Eli.","visible_action":"At 11:52 p.m. actual time, Mara inspects the enclosed vehicle deck and finds a spreading patch of fresh water beneath Councillor Saye's locked grey car, then checks it with her fingers and notices there is no route for rain to reach the centre lane.","reader_effect":"Creates a concrete, testable disturbance and makes Mara's engineering judgement the immediate source of tension.","continuity_risk":"The water must remain unexplained and distinct from ordinary salt water without implying a confirmed supernatural cause.","exit_condition":"Mara hears movement from the passenger lounge and leaves the vehicle deck to identify who may have seen the water."},{"id":"S2","purpose":"Introduce Nessa's claim and connect the present crossing to Eli without resolving whether the claim is true.","visible_action":"Mara questions Nessa about travelling alone; Nessa produces her paper ticket stamped 23:40 and says Eli sent her a message that evening telling her to take the final ferry. Mara recognises the name and knows Eli's number was disconnected eleven years ago.","reader_effect":"Makes Nessa vulnerable rather than plainly deceptive, while reopening Mara's guilt and uncertainty about Eli.","continuity_risk":"Nessa must not be exposed as knowingly lying, and Eli must remain absent; the message can be reported but not verified.","exit_condition":"Mara asks to see the message, but Saye interrupts and points to the ticket as evidence that Nessa boarded outside the proper process."},{"id":"S3","purpose":"Give Saye a plausible defensive tactic and prevent the scene from settling into a simple interrogation of Nessa.","visible_action":"Saye keeps one hand on the grey document case and redirects Mara toward Nessa's ticket, demanding that Mara check the manifest and suggesting the teenager may have entered without authorisation.","reader_effect":"Splits suspicion between the anomalous water, Saye's guarded conduct, and Nessa's uncertain story.","continuity_risk":"Saye's case must remain intact and his behaviour must support suspicion without proving criminal intent.","exit_condition":"Mara refuses to treat the ticket as the main problem and returns to the vehicle deck, with Nessa following at a cautious distance."},{"id":"S4","purpose":"Escalate the physical mystery through evidence Mara can document and compare.","visible_action":"Mara shines her torch beneath Saye's car, traces the fresh water towards the locked maintenance stair, and checks the deck drain and overhead seals; both are dry and the ferry continues its crossing under Tom's control in the wheelhouse.","reader_effect":"Narrows the possible source while confirming that the vessel is still moving and help is not immediately available.","continuity_risk":"Tom must remain in the wheelhouse, and the fresh water must not be explained by rain, flooding, or an unnoticed routine leak.","exit_condition":"The maintenance stair alarm panel gives a recorded opening time of 11:55 p.m. actual time, despite Mara having seen the stair door closed."},{"id":"S5","purpose":"Force Mara's central choice between confronting Nessa and investigating a potentially immediate threat.","visible_action":"Mara compares the alarm's actual timestamp with the ferry clock, orders Nessa to stay beside the passenger-lounge doorway, and tells Saye not to move while she takes the master key towards the maintenance stair.","reader_effect":"Turns suspicion into a time-critical decision and makes Mara's protective instinct compete with her need for evidence.","continuity_risk":"Mara cannot fully secure either passenger, and the timestamp must not be confused with the ferry clock being seven minutes slow.","exit_condition":"Nessa asks whether Eli knew Mara would be aboard; Mara pauses at the question, then hears a second metallic movement beyond the locked stair."},{"id":"S6","purpose":"Deliver the stop/escalation decision while preserving competing explanations.","visible_action":"Mara stops short of opening the stair, switches off the deck lights, and uses the intercom to tell Tom to keep the ferry on course and watch the wheelhouse instruments; she leaves Nessa and Saye in sight but does not confront Nessa about the alleged message.","reader_effect":"Suspends the immediate reveal and increases danger by placing Mara in darkness with an unverified presence beyond the door.","continuity_risk":"The unseen movement cannot establish Eli's physical presence, and the compass may react only as an ambiguous sensory detail rather than a solution.","exit_condition":"Eli's brass compass pulls sharply inland in Mara's palm as water slips beneath the stair threshold, giving her enough evidence of an active hazard to act without knowing its source."},{"id":"S7","purpose":"End on a consequential choice that opens the next chapter without closing the mystery.","visible_action":"Mara wedges the stair door with a maintenance bar, tells Nessa to take the document case's opposite side if Saye tries to move it, and chooses to reopen the alarmed stair rather than return to interrogate Nessa or inspect the message.","reader_effect":"Leaves Mara committed to a dangerous investigation, with Nessa's claim, Saye's case, and the water still capable of different interpretations.","continuity_risk":"Mara must not open or damage the document case, Nessa must not be exposed as knowingly deceptive, and Eli must not physically appear.","exit_condition":"Mara raises the bar and begins opening the stair while the ferry reaches mid-channel, turning the unresolved alarm into the next immediate threat."}],"decision":"Mara chooses to investigate and reopen the maintenance stair before confronting Nessa about Eli's message, while keeping both Nessa and Saye within sight and instructing Tom to maintain course and watch the wheelhouse.","protected_non_actions":["Mara does not force Nessa to prove the message or accuse her of knowingly lying; the claim remains emotionally credible but unverifiable.","Mara does not open, seize, or damage Saye's locked grey document case, preserving it intact for downstream chapters.","Mara does not treat the compass response or the fresh water as proof that Eli is present."],"escalation_curve":["Concrete anomaly: fresh water beneath Saye's car where rain cannot reach.","Social pressure: Nessa invokes Eli and Saye redirects suspicion towards her ticket.","Time-critical threat: the maintenance stair records an opening at 11:55 p.m. actual time and movement is heard beyond it.","Committed danger: Mara begins reopening the stair at mid-channel without knowing who or what is behind it."],"verdict":"proceed"}
